{
  "$schema": "https://json-schema.org/draft/2020-12/schema",
  "$id": "https://axf.amberxai.com/schemas/project-manifest.schema.json",
  "title": "AXF project manifest (project-manifest@1)",
  "description": "Generated from framework/schemas/project-rules.json. Errors here are hints; the rules are what the build engine enforces.",
  "type": "object",
  "required": [
    "$manifest",
    "name",
    "displayName",
    "kind"
  ],
  "properties": {
    "$manifest": {
      "description": "The file says which format it is: \"$manifest\": \"project-manifest@1\".",
      "const": "project-manifest@1"
    },
    "name": {
      "description": "Lowercase letters, digits and dashes, starting with a letter or digit, up to 63 characters. It is the project's folder on the hub (/projects/<name>), so it never changes lightly.",
      "type": "string",
      "pattern": "^[a-z0-9][a-z0-9-]{0,62}$"
    },
    "displayName": {
      "description": "A human name, 1 to 80 characters.",
      "type": "string",
      "minLength": 1,
      "maxLength": 80
    },
    "kind": {
      "description": "What the project is: one of the kind vocabulary.",
      "enum": [
        "framework",
        "app",
        "library",
        "plugin",
        "module",
        "template",
        "service",
        "tool",
        "other"
      ]
    },
    "status": {
      "description": "active, planned, dormant or archived (active when left out).",
      "enum": [
        "active",
        "planned",
        "dormant",
        "archived"
      ]
    },
    "framework": {
      "type": "object",
      "properties": {
        "relation": {
          "description": "framework.relation: core (the framework itself), built-on (an AXF app or library), for (made to work with AXF) or none.",
          "enum": [
            "core",
            "built-on",
            "for",
            "none"
          ]
        },
        "appManifest": {
          "description": "framework.appManifest, when given, points at the app's axf.manifest.json."
        }
      },
      "required": [
        "relation"
      ]
    },
    "repo": {
      "type": "object",
      "properties": {
        "owner": {
          "description": "repo.owner: the GitHub (or other host) account, e.g. MossesX.",
          "type": "string",
          "pattern": "^[A-Za-z0-9][A-Za-z0-9-]{0,38}$"
        },
        "name": {
          "description": "repo.name: the project's own repository name. Required even when the repo doesn't exist yet, so it can be created with that name later.",
          "type": "string",
          "pattern": "^[A-Za-z0-9._-]{1,100}$"
        },
        "exists": {
          "description": "repo.exists: true when the repository has been created, false when it is only reserved for the future.",
          "type": "boolean"
        },
        "host": {
          "description": "repo.host: github, gitlab, bitbucket or other (github when left out).",
          "enum": [
            "github",
            "gitlab",
            "bitbucket",
            "other"
          ]
        },
        "visibility": {
          "description": "repo.visibility: private, public or internal.",
          "enum": [
            "private",
            "public",
            "internal"
          ]
        },
        "url": {
          "description": "repo.url, when given, is an https address.",
          "type": "string",
          "pattern": "^https://"
        }
      },
      "required": [
        "owner",
        "name",
        "exists"
      ]
    },
    "location": {
      "description": "When the project has no repo of its own yet, location says where its code is now (location.repo + location.path)."
    },
    "version": {
      "description": "version, when given, is semver (1.2.3, optionally -pre).",
      "type": "string",
      "pattern": "^[0-9]+\\.[0-9]+\\.[0-9]+(-[0-9A-Za-z.-]+)?$"
    },
    "platforms": {
      "description": "platforms lists where it runs, from the platform vocabulary.",
      "type": "array",
      "items": {
        "enum": [
          "web",
          "android",
          "desktop",
          "server",
          "python",
          "ios",
          "cli"
        ]
      }
    },
    "created": {
      "description": "created, when given, is a date: YYYY-MM-DD.",
      "type": "string",
      "pattern": "^[0-9]{4}-[0-9]{2}-[0-9]{2}$"
    },
    "data": {
      "type": "object",
      "properties": {
        "shared": {
          "description": "data.shared lists the project's shared data as paths inside the project (folders end with /). They sync with /projects/<name>/_data/<same path>.",
          "type": "array",
          "items": {
            "type": "string"
          }
        }
      }
    },
    "description": {},
    "deploy": {},
    "owners": {},
    "links": {},
    "notes": {},
    "x": {}
  }
}
