{
  "$manifest": "project-manifest@1",
  "name": "amberx-droid",
  "displayName": "AmberX",
  "description": "AmberX: voice-controlled, plugin-driven Android app that watches axHub in the background and takes over the AXHub app",
  "kind": "app",
  "status": "active",
  "version": "0.1.0",
  "platforms": [
    "web",
    "android"
  ],
  "framework": {
    "relation": "built-on",
    "version": "0.2.0",
    "template": "react-ts",
    "appManifest": "axf.manifest.json"
  },
  "repo": {
    "host": "github",
    "owner": "MossesX",
    "name": "amberx-droid",
    "exists": false,
    "visibility": "private"
  },
  "location": {
    "repo": "MossesX/AmberX-AXF",
    "path": "apps/amberx-droid"
  },
  "data": {
    "shared": []
  },
  "owners": [
    "MossesX"
  ],
  "created": "2026-10-25"
}
